{
  "schemaVersion": "fog-of-sea.lattice-copy.runtime.v1",
  "snapshotId": "lattice-copy-6bae02e4df7e11fcdb9d62d5",
  "copySha256": "b0f1f86c0d4c19c48ceeafc7f18e805987c7b311cdcda0519268522954d7149c",
  "copy": {
    "academy.compare.intro": "Compare thinkers who confronted overlapping historical problems, then test whether ideas from different settings can form one coherent theory. These summaries compress complex works. Return to the lessons and primary texts before drawing conclusions.",
    "academy.sources.independentStatus": "FOG OF SEA and its Academy are independently produced fictional educational work. They are not affiliated with, sponsored by, approved by, or endorsed by any government agency, manufacturer, school, or credentialing body. The Academy grants no academic credit or certification.",
    "academy.sources.intro": "This independent learning space separates original instructional synthesis, suggested reading, and assumptions used by the fictional model. The reading room offers starting points for further study; it does not verify individual claims or replace primary texts and suitable scholarship.",
    "academy.sources.languageSystem": "Selected static in-game and Academy copy is processed through the pinned Lattice contract and profile. Automated checks test declared semantic coverage, prohibited claims, accessibility dependencies, and deterministic derivation; they do not establish factual truth, literary quality, human review, or endorsement.",
    "academy.sources.modelBoundary": "Capability families loosely synthesize publicly described maritime concepts, then deliberately alter names, combinations, personnel, capacity, and performance. Differences in realism reflect subject-matter inexperience and deliberate abstraction; they are not claims about current capability.",
    "academy.strategy.complementTheory": "Use the second theory to add a missing mechanism or challenge the primary theory with a different prediction. State what each contributes, where their assumptions conflict, and how the strategy resolves that conflict. A second label without a distinct job is not a synthesis, and this guide does not identify a scored pairing.",
    "academy.strategy.endState": "Frame the end state as an observable political condition, not an activity or force position. Compare each option with the stated political aim, objective, success conditions, and constraints; then ask what must remain true at transition. This guide does not identify a scored choice.",
    "academy.strategy.guardrail": "Choose the guardrail whose breach would make apparent mission success politically self-defeating. Test each option against the visible constraints, civilian context, partner dependence, authority and trust, and endurance. One guardrail controls the plan, but the others remain obligations; this guide does not identify a scored choice.",
    "academy.strategy.primaryTheory": "Treat each theory as a causal mechanism, not a famous name. Ask how maritime action is expected to create the chosen political condition, what assumptions it depends on, and what visible evidence would count against it. Study the scenario-relevant premises, then make the selection yourself.",
    "academy.strategy.warfareAreas": "Connect every warfare-area choice to a visible task in the mission brief. Name the effect that task requires, distinguish the effect from a platform or threat, and leave an area unselected when no visible evidence supports it. Availability alone is not evidence, and this guide does not identify a scored choice.",
    "game.guide.commandTurns.interpretive": "Each turn reports range, contact quality, force integrity, command readiness, supply, objective progress, and escalation. Those values expose tradeoffs rather than one universally correct posture. Undo lets you compare orders from the same state; it does not buy a new result.",
    "game.guide.commandTurns.operative": "Choose how the force moves, senses, coordinates, manages risk, and acts. After resolution, range, contact quality, force integrity, command readiness, supply, objective progress, and escalation report the modeled result. Orders can trade progress or protection against supply, time, contact, integrity, or escalation. Canonical replay from the same saved state and orders reproduces the same adjudicated outcome; Undo supports comparison rather than rerolling.",
    "game.guide.missionCredit.interpretive": "Mission credit follows the connection between an identified task and compatible support. Aircraft require deck space; mission packs require a host. Unsupported selections can remain aboard without adding coverage. Environmental fit is a separate check, and a connected force can still fit its environment poorly.",
    "game.guide.missionCredit.operative": "A selection earns mission credit only when it is tied to an identified warfare area, fits the mission, and has the support it requires. Aircraft require compatible deck space. Mission packs require compatible host slots. Unsupported selections may remain in the force, but they add no mission coverage. Environmental fit is checked separately.",
    "game.guide.missionLearning.interpretive": "Mission-credit and pairing references remain in the Field Guide. The review follows what the record can support. It can name a tracked mismatch, a committed matrix failure, or a final diagnostic finding and connect evidence to an adjustment. Silence from those checks is not proof of correctness, feasibility, causation, or the best possible decision.",
    "game.guide.missionLearning.operative": "Mission-credit and pairing references remain in the Field Guide. Only connected, compatible selections tied to an identified warfare area earn mission credit. After a turn resolves, the interface reports tracked evidence and offers a focused adjustment only when a tracked mismatch or final finding supports one. When no tracked mismatch or finding is recorded, the interface states that limited absence; it does not infer a cause, full compliance, or optimal play.",
    "game.guide.modelBoundary.interpretive": "FOG OF SEA is a notional educational model. It gives decisions a coherent fictional frame, not authority over the real world. Its names and numbers are invented for play inside that frame. They do not describe a current force, predict an outcome, or recommend an operation.",
    "game.guide.modelBoundary.operative": "FOG OF SEA is a notional educational model. It does not provide current doctrine, readiness, disposition, targeting, or operational recommendations. Platforms, systems, personnel, capacities, points, ranges, track capacities, contacts, performance, and readiness thresholds are fictionalized or invented. Differences from real-world practice are not claims about current capability.",
    "game.guide.scenarioAcceptance.interpretive": "The generator keeps a candidate only when its modeled parts survive the coexistence checks the application actually implements. That is a consistency boundary, not a feasibility oracle: conditions outside those checks may still be unrealistic, incomplete, or wrong.",
    "game.guide.scenarioAcceptance.operative": "Each candidate scenario is checked for implemented consistency across region, season, light, weather, sea conditions, geography, mission, actors, force needs, and objectives. If an implemented check fails, the whole candidate is discarded and another is generated. Passing these checks does not establish real-world feasibility or validity.",
    "game.guide.strategicFit.interpretive": "The brief binds means to political purpose. A coherent selection names the condition sought, the theories supporting the method, and the guardrail that must still hold. Optional writing can clarify that reasoning for the player, but it never alters the score; the result belongs to this model, not to real-world odds.",
    "game.guide.strategicFit.operative": "The selected political end state, theory lenses, guardrail, and force plan are checked against the scenario's implemented requirements. Optional writing is stored only when the player consents and is never scored. Results describe the fictional model, not real-world odds.",
    "game.guide.uncrewedUndersea.interpretive": "Distributed scouting, deception swarms, attritable massing, and autonomous lane control answer different modeled problems; independent patrols, coordinated wolfpacks, barrier ambushes, and protective screens do the same beneath the surface. They matter only through relationships among hosts, mission pairings, credited force size, and the situation being faced. A wolfpack label cannot manufacture coordination; without two credited undersea elements, the model records coordination and escalation costs.",
    "game.guide.uncrewedUndersea.operative": "Uncrewed systems contribute only when their hosts and mission pairings receive credit. Distributed scouting, deception swarms, attritable massing, and autonomous lane control address different modeled problems. Independent patrols, coordinated wolfpacks, barrier ambushes, and protective screens depend on credited force size and the modeled situation. A coordinated wolfpack with fewer than two credited undersea elements incurs coordination and escalation penalties.",
    "game.learning.outcome.adjustment": "A TRACKED FINDING WAS RECORDED\nThe record contains at least one final diagnostic finding. Each finding below pairs its recorded evidence with one practical adjustment for another attempt.",
    "game.learning.outcome.clear": "NO FINAL FINDING RECORDED\nNo final diagnostic finding was recorded. Use the score components and timeline to inspect the result.",
    "game.learning.outcome.pending": "REVIEW PENDING\nComplete the scenario to receive an after-action review.",